<?xml version="1.0" encoding="UTF-8"?>
<caches appName="test" xmlns="http://www.hualife.com/foundation/component/cache" xmlns:xsi="http://www.w3.org/2001/XMLSchema-instance" xsi:schemaLocation="http://www.hualife.com/foundation/component/cache cache.xsd ">
  <cache name="test" provider="Guava" statisticsEnabled="false" transactionEnabled="false">
    <cacheListeners>
      <cacheListener impl="" listenerType="create" syn="true"/>
    </cacheListeners>
    <expiry expiryTime="0" expiryType=""/>
    <cacheLoader impl="">
      <asyn bufferSize="0" period=""/>
    </cacheLoader>
    <share operation="" scope=""/>
  </cache>
</caches>
	